{
  "v": 1,
  "msg_id": "20261021T0600Z-s1-nozzle_fault/line1/counts/pnp/9660",
  "run_id": "20261021T0600Z-s1-nozzle_fault",
  "ts": "2026-10-21T08:41:00.000Z",
  "sim_time_s": 9660.0,
  "line": "line1",
  "station": "pnp",
  "part_count": 402,
  "reject_count": 0,
  "part_count_by_product": {
    "CTRL-BOARD-A": 402
  },
  "speed_pct": 100.0,
  "extra": {
    "mispick_count": 17
  }
}
